{
  "schemaVersion": "0.1",
  "item": {
    "name": "text-reveal",
    "version": "0.1.0",
    "summary": "headline: word/line/char text reveal (dom, server-safe); SSR text stays static; reduced motion -> static; low-end mobile -> 40 ms stagger",
    "slot": "headline",
    "kind": "dom"
  },
  "intent": {
    "useWhen": [
      "Hero headlines and section titles requiring editorial typographic reveals",
      "Marketing landing pages with high-signal opening statements",
      "Feature headings that need stepped entrance animations"
    ],
    "avoidWhen": [
      "Long paragraphs or running prose (> 2 lines of body text)",
      "Frequently updating real-time data or tickers",
      "Forms and interactive controls"
    ],
    "alternatives": [
      {
        "name": "scroll-reveal",
        "when": "When revealing whole blocks, cards, or media rather than individual text tokens"
      }
    ]
  },
  "runtime": {
    "serverOutput": "final-state",
    "clientOnly": false,
    "lazyLoaded": "no",
    "requires": {
      "react": ">=19",
      "frameworks": [
        "next-app-router",
        "vite-react"
      ],
      "tailwind": "none"
    }
  },
  "dependencies": {
    "npm": [],
    "registry": []
  },
  "behavior": {
    "loop": "none",
    "webglContexts": 0,
    "tiers": {
      "0": "Plain static text, no splitting (server render, prefers-reduced-motion, Save-Data, or no WebGL2)",
      "1": "Animated reveal with the stagger capped at 40 ms (coarse pointer with low-end hints)",
      "2": "Animated reveal with the configured stagger (60 ms by default)",
      "3": "Same as tier 2; the `by` mode (word, character, line) is honoured at every animated tier"
    },
    "reducedMotion": {
      "mode": "static",
      "description": "Renders plain static text without splitting or animations."
    },
    "input": {
      "pointer": "None. The reveal plays once when the component mounts on the client (for example in a Vite SPA or after client-side navigation) or when replayKey changes. A server-rendered instance is painted as static final text and does not animate unless replayKey is set.",
      "touch": "Same as pointer; the stagger is capped at 40 ms only on tier 1 and tier 0 devices",
      "keyboard": "None; the text is not focusable. It stays selectable. Screen readers read a visually hidden copy of the full text; the animated tokens are aria-hidden."
    }
  },
  "a11y": {
    "role": "content",
    "hiddenFromAT": false,
    "textStaysInDom": true,
    "pauseControl": "not-needed",
    "wcag": [
      "1.3.1",
      "1.4.3",
      "2.2.2"
    ],
    "notes": "Original text is preserved in a visually-hidden span while animated tokens are marked aria-hidden='true', ensuring screen readers never read fragmented letters or words."
  },
  "composition": {
    "maxPerPage": 5,
    "singleton": false,
    "conflictsWith": [],
    "pairsWith": [
      "noise-field",
      "magnetic-button",
      "ambient-hero"
    ]
  },
  "props": [
    {
      "name": "children",
      "type": "string",
      "default": null,
      "effect": "Required. Plain text string to split and reveal (not JSX)."
    },
    {
      "name": "as",
      "type": "React.ElementType",
      "default": "h1",
      "effect": "HTML tag to render as root container."
    },
    {
      "name": "by",
      "type": "\"word\" | \"character\" | \"line\"",
      "default": "word",
      "effect": "Token granularity for entrance stagger."
    },
    {
      "name": "delay",
      "type": "number",
      "default": 0,
      "effect": "Initial delay in ms before animation begins."
    },
    {
      "name": "stagger",
      "type": "number",
      "default": 60,
      "effect": "Delay in ms between subsequent token animations. Capped at 40 ms when the tier is 1 or lower."
    },
    {
      "name": "duration",
      "type": "number",
      "default": 400,
      "effect": "Duration in ms for each token entrance."
    },
    {
      "name": "className",
      "type": "string",
      "default": "",
      "effect": "Extra classes on the root element (the built-in class fb-text-reveal is kept)."
    },
    {
      "name": "style",
      "type": "React.CSSProperties",
      "default": null,
      "effect": "Optional. No default. Inline styles on the root element, merged after position: relative and display: block (consumer wins)."
    },
    {
      "name": "ref",
      "type": "React.Ref<any>",
      "default": null,
      "effect": "Receives the root element chosen by `as` (it also contains the scoped <style> and a screen-reader copy of the text)."
    },
    {
      "name": "maxTier",
      "type": "number",
      "default": 3,
      "effect": "Hard ceiling on the capability tier."
    },
    {
      "name": "replayKey",
      "type": "string | number",
      "default": null,
      "effect": "Optional. No default. When set (or changed), the entrance animation plays after hydration even for a server-rendered instance."
    },
    {
      "name": "paused",
      "type": "boolean",
      "default": false,
      "effect": "Universal pause prop. Renders plain static text instead of the animated tokens; un-pausing replays the reveal from the start (it does not freeze mid-animation)."
    },
    {
      "name": "nonce",
      "type": "string",
      "default": null,
      "effect": "Optional CSP nonce forwarded to the internal scoped <style> element."
    }
  ],
  "agent": {
    "install": "npx shadcn@latest add @frictionborn/text-reveal",
    "usage": "import { TextReveal } from \"@/components/ui/text-reveal\";\n\nexport default function HeroHeadline() {\n  return (\n    <TextReveal as=\"h1\" by=\"word\" className=\"text-4xl font-bold tracking-tight\">\n      Engineered Motion for High-Signal Interfaces\n    </TextReveal>\n  );\n}",
    "mistakes": [
      "Do not pass complex React elements or JSX as children; TextReveal expects a text string to tokenize.",
      "Do not hide text with opacity: 0 before hydration; the component handles static visibility safely.",
      "A server-rendered TextReveal is painted as final static text and does not animate unless replayKey is set; do not expect a reveal on a Next.js server-rendered hero without it.",
      "Other props (data-*, aria-*, handlers) are spread on the root element; do not pass your own id (the component uses its own to detect a server render).",
      "The reveal styles apply only when <html> has data-motion=\"ok\" (MotionReadyScript in Next, initMotionReady() in Vite)."
    ],
    "verify": [
      "Verify full headline text is present in server HTML before JavaScript executes.",
      "Verify screen reader reads text as a single coherent sentence without letter-by-letter pauses.",
      "Verify reduced motion produces immediate static text with zero rAF cycles."
    ]
  },
  "license": {
    "code": "MIT",
    "derivedFrom": [],
    "notices": [],
    "assets": []
  }
}
