{
  "schemaVersion": "0.1",
  "item": {
    "name": "smooth-scroll",
    "version": "0.1.0",
    "summary": "page-provider: Lenis provider stepped strictly via useFrame with autoRaf false (dom, server-safe, singleton, reduced motion -> off, mobile -> off)",
    "slot": "page-provider",
    "kind": "scroll-provider"
  },
  "intent": {
    "useWhen": [
      "Marketing landing pages requiring unified cinematic scroll feel",
      "Editorial feature stories paired with sticky scroll narratives",
      "Desktop viewports with fine pointers and high-refresh displays"
    ],
    "avoidWhen": [
      "Dashboards and data-dense productivity software",
      "Documentation sites and code-heavy portals",
      "Forms-heavy pages and modal-only checkout flows",
      "Touchscreens and mobile devices (automatically disabled on coarse pointers)"
    ],
    "alternatives": [
      {
        "name": "native-scroll",
        "when": "When standard browser compositor scrolling is sufficient without kinetic interpolation"
      }
    ]
  },
  "runtime": {
    "serverOutput": "static-layout",
    "clientOnly": false,
    "lazyLoaded": "no",
    "requires": {
      "react": ">=19",
      "frameworks": [
        "next-app-router",
        "vite-react"
      ],
      "tailwind": "none"
    }
  },
  "dependencies": {
    "npm": [
      {
        "name": "lenis",
        "version": "1.3.26",
        "license": "MIT"
      }
    ],
    "registry": []
  },
  "behavior": {
    "loop": "on-interaction",
    "webglContexts": 0,
    "tiers": {
      "0": "Not gated by tier. Smooth scrolling runs unless reduced motion, enabled={false} or a coarse pointer disables it; Save-Data and no-WebGL2 (tier 0) do not disable it",
      "1": "Coarse pointer: disabled, native touch momentum scrolling preserved",
      "2": "Coarse pointer: disabled. On a fine or absent pointer (low-end hints or viewport < 480px) smooth scrolling runs, stepped via useFrame",
      "3": "Smooth scrolling runs (fine pointer with hover), stepped via useFrame; same behaviour as tier 2 on fine pointers"
    },
    "reducedMotion": {
      "mode": "off",
      "description": "Disabled completely; 100% native platform momentum scrolling."
    },
    "input": {
      "pointer": "Wheel input is interpolated by Lenis (smoothWheel) unless the pointer is coarse, reduced motion is set, or enabled is false",
      "touch": "Native touch momentum scrolling is preserved; Lenis is inactive on coarse pointers",
      "keyboard": "Keys (Space, PageUp, PageDown, arrows, Home, End) scroll natively; Lenis does not intercept them and a keydown only wakes the shared frame loop"
    }
  },
  "a11y": {
    "role": "content",
    "hiddenFromAT": false,
    "textStaysInDom": true,
    "pauseControl": "not-needed",
    "wcag": [
      "2.1.1",
      "2.2.2",
      "2.3.3"
    ],
    "notes": "Native keyboard scrolling is preserved. When reduced motion is preferred, smooth scrolling is turned off completely, delegating all scroll behavior to the native platform compositor."
  },
  "composition": {
    "maxPerPage": 1,
    "singleton": true,
    "conflictsWith": [],
    "pairsWith": [
      "sticky-scroll-story",
      "scroll-reveal",
      "noise-field"
    ]
  },
  "props": [
    {
      "name": "children",
      "type": "React.ReactNode",
      "default": null,
      "effect": "Optional. No default. Child components wrapped inside the provider (rendered in a display: contents div)."
    },
    {
      "name": "duration",
      "type": "number",
      "default": 1200,
      "effect": "Scroll easing duration in milliseconds (e.g. 1200 means 1.2 seconds)."
    },
    {
      "name": "paused",
      "type": "boolean",
      "default": false,
      "effect": "Universal pause prop. Freezes kinetic smooth scrolling."
    },
    {
      "name": "easing",
      "type": "(t: number) => number",
      "default": "(t) => Math.min(1, 1.001 - Math.pow(2, -10 * t))",
      "effect": "Easing function (default is a module-level function). Read through a ref, so an inline function does not recreate Lenis."
    },
    {
      "name": "orientation",
      "type": "\"vertical\" | \"horizontal\"",
      "default": "vertical",
      "effect": "Primary scroll orientation."
    },
    {
      "name": "gestureOrientation",
      "type": "\"vertical\" | \"horizontal\" | \"both\"",
      "default": "vertical",
      "effect": "Gesture direction Lenis listens to."
    },
    {
      "name": "smoothWheel",
      "type": "boolean",
      "default": true,
      "effect": "Whether to interpolate mouse wheel deltas."
    },
    {
      "name": "touchMultiplier",
      "type": "number",
      "default": 1,
      "effect": "Lenis touch multiplier (touch scrolling is not smoothed on coarse pointers because SmoothScroll is disabled there)."
    },
    {
      "name": "infinite",
      "type": "boolean",
      "default": false,
      "effect": "Lenis infinite scroll option."
    },
    {
      "name": "enabled",
      "type": "boolean",
      "default": true,
      "effect": "Master toggle to enable or disable smooth scrolling."
    },
    {
      "name": "onScroll",
      "type": "(e: any) => void",
      "default": null,
      "effect": "Called with the Lenis scroll event (not the DOM scroll event, even though the root is a <div>)."
    },
    {
      "name": "prevent",
      "type": "(node: HTMLElement) => boolean",
      "default": null,
      "effect": "Optional. No default. Predicate to bypass smooth scrolling for specific DOM nodes. Nested scrollers (allowNestedScroll) and [role=\"dialog\"], [aria-modal=\"true\"], dialog[open], [data-lenis-prevent] are always bypassed."
    },
    {
      "name": "ref",
      "type": "React.Ref<HTMLDivElement>",
      "default": null,
      "effect": "Receives the root <div>, which is display: contents, so its bounding box is empty (use it for data attributes, not geometry)."
    }
  ],
  "agent": {
    "install": "npx shadcn@4.21.1 add @frictionborn/smooth-scroll",
    "usage": "import { SmoothScroll } from \"@/components/ui/smooth-scroll\";\n\nexport default function RootLayout({ children }: { children: React.ReactNode }) {\n  return (\n    <SmoothScroll>\n      {children}\n    </SmoothScroll>\n  );\n}",
    "mistakes": [
      "Do not mount multiple SmoothScroll instances; SmoothScroll is a singleton provider (a second mount warns and does nothing).",
      "Do not import Lenis directly or create separate requestAnimationFrame loops.",
      "Do not use on dashboards, forms-heavy pages, or data-dense web applications.",
      "The registry installs lenis@1.3.26 and consumers accept lenis@^1.3.26; to pin exactly run: npm install --save-exact lenis@1.3.26 (or the equivalent for your package manager).",
      "SmoothScroll is stepped by the shared useFrame loop. While the runtime pauseAll() is active (the runtime global pause; AmbientHero's own pause button no longer triggers it) that loop, and therefore SmoothScroll's stepping, is stopped; verify wheel scrolling on pages that combine them.",
      "duration is in milliseconds (1200 = 1.2 s). A seconds value such as 1.2 now means 1.2 ms and the scroll looks instant."
    ],
    "verify": [
      "Verify keyboard navigation (Space, PageUp/Down, Arrows) works identically to native scrolling.",
      "Verify hash anchors (#section-id) jump smoothly without layout offsets.",
      "Verify reduced motion disables Lenis and returns 100% control to the platform."
    ]
  },
  "license": {
    "code": "MIT",
    "derivedFrom": [
      {
        "what": "Lenis smooth scroll engine",
        "url": "https://github.com/darkroomengineering/lenis",
        "license": "MIT"
      }
    ],
    "notices": [],
    "assets": []
  },
  "measured": {
    "commit": "da21af4",
    "date": "2026-10-05",
    "sizeKB": {
      "initial": 2.75,
      "deferred": 0.02,
      "method": "gzip-9"
    },
    "cls": 0,
    "framesWhenIdle": {
      "offscreen": 0,
      "hiddenTab": 0,
      "reducedMotion": 0
    },
    "axe": {
      "serious": 0,
      "critical": 0
    },
    "devices": [
      {
        "env": "Chromium Desktop (SwiftShader)",
        "via": "playwright",
        "tier": 3,
        "result": "pass",
        "date": "2026-10-05",
        "notes": "18 passed, 0 failed"
      },
      {
        "env": "Chromium Mobile (Pixel 7 emulation)",
        "via": "playwright",
        "tier": 2,
        "result": "pass",
        "date": "2026-10-05",
        "notes": "13 passed, 0 failed"
      },
      {
        "env": "Firefox Desktop",
        "via": "playwright",
        "tier": 3,
        "result": "pass",
        "date": "2026-10-05",
        "notes": "18 passed, 0 failed"
      },
      {
        "env": "WebKit Desktop",
        "via": "playwright",
        "tier": 3,
        "result": "pass",
        "date": "2026-10-05",
        "notes": "18 passed, 0 failed"
      },
      {
        "env": "WebKit Mobile (iPhone 14 emulation)",
        "via": "playwright",
        "tier": 2,
        "result": "pass",
        "date": "2026-10-05",
        "notes": "13 passed, 0 failed"
      }
    ]
  }
}
