{
  "schemaVersion": "0.1",
  "item": {
    "name": "scroll-reveal",
    "version": "0.1.0",
    "summary": "media: Scroll-driven entrance (CSS view() timeline, IntersectionObserver fallback) (dom, server-safe, reduced motion -> static, low-end mobile -> 12px)",
    "slot": "media",
    "kind": "dom"
  },
  "intent": {
    "useWhen": [
      "Feature cards, images, and marketing content blocks entering the viewport",
      "Staggered grid items revealing progressively during downward scroll",
      "Sections where scroll-triggered visibility enhances progressive narrative"
    ],
    "avoidWhen": [
      "Above-the-fold hero elements that must paint immediately for LCP",
      "Sticky navigation bars or persistent floating controls",
      "Dense data tables and interactive form fields"
    ],
    "alternatives": [
      {
        "name": "text-reveal",
        "when": "When revealing headline text tokens rather than containers or media elements"
      }
    ]
  },
  "runtime": {
    "serverOutput": "final-state",
    "clientOnly": false,
    "lazyLoaded": "in-view",
    "requires": {
      "react": ">=19",
      "frameworks": [
        "next-app-router",
        "vite-react"
      ],
      "tailwind": "none"
    }
  },
  "dependencies": {
    "npm": [],
    "registry": []
  },
  "behavior": {
    "loop": "none",
    "webglContexts": 0,
    "tiers": {
      "0": "Content fully visible and static, no reveal classes (server render, prefers-reduced-motion, Save-Data, or no WebGL2)",
      "1": "Reveal with the travel distance capped at 12px (coarse pointer with low-end hints)",
      "2": "Reveal with the configured travel distance (24px by default)",
      "3": "Same as tier 2. At every animated tier, browsers that support animation-timeline use the scroll-linked CSS animation; others use the IntersectionObserver fallback. The observer hook is mounted in both cases."
    },
    "reducedMotion": {
      "mode": "static",
      "description": "Content is rendered in its final visible state without transition delays or scroll triggers."
    },
    "input": {
      "pointer": "Scroll-linked entrance as the container enters the viewport. Where animation-timeline: view() is supported the animation is scroll-linked and reverses when scrolling back up.",
      "touch": "Same scroll trigger; the travel distance is capped at 12px only on tier 1 and tier 0 devices",
      "keyboard": "Focus-within guard forces element visible immediately when tabbed into"
    }
  },
  "a11y": {
    "role": "content",
    "hiddenFromAT": false,
    "textStaysInDom": true,
    "pauseControl": "not-needed",
    "wcag": [
      "1.3.1",
      "1.4.3",
      "2.2.2"
    ],
    "notes": "Focus guard forces any element containing active focus visible immediately, preventing keyboard traps during scroll. Hidden-before-reveal styles exist only under html[data-motion=\"ok\"]; server HTML and reduced-motion users see the content visible."
  },
  "composition": {
    "maxPerPage": 20,
    "singleton": false,
    "conflictsWith": [],
    "pairsWith": [
      "noise-field",
      "text-reveal",
      "magnetic-button"
    ]
  },
  "props": [
    {
      "name": "children",
      "type": "React.ReactNode",
      "default": null,
      "effect": "Required. Content elements wrapped and revealed on scroll."
    },
    {
      "name": "as",
      "type": "React.ElementType",
      "default": "div",
      "effect": "HTML tag rendered as root container."
    },
    {
      "name": "animation",
      "type": "\"fade-up\" | \"fade\" | \"scale-up\"",
      "default": "fade-up",
      "effect": "Visual entrance variant."
    },
    {
      "name": "distance",
      "type": "number",
      "default": 24,
      "effect": "Vertical travel distance in pixels (half of it for scale-up); capped at 12 when the tier is 1 or lower."
    },
    {
      "name": "duration",
      "type": "number",
      "default": 400,
      "effect": "Transition duration in ms. Applies only to the IntersectionObserver fallback; the native view-timeline animation is scroll-linked and ignores it."
    },
    {
      "name": "once",
      "type": "boolean",
      "default": true,
      "effect": "In the IntersectionObserver fallback, true keeps the content revealed after the first entry. The native view-timeline path is scroll-linked and reverses when scrolling back up regardless of this prop."
    },
    {
      "name": "className",
      "type": "string",
      "default": "",
      "effect": "Extra classes on the root element (the built-in class fb-scroll-reveal is kept)."
    },
    {
      "name": "style",
      "type": "React.CSSProperties",
      "default": null,
      "effect": "Optional. No default. Inline styles on the root element, merged after display: block and position: relative (consumer wins)."
    },
    {
      "name": "ref",
      "type": "React.Ref<any>",
      "default": null,
      "effect": "Receives the root element chosen by `as`."
    },
    {
      "name": "maxTier",
      "type": "number",
      "default": 3,
      "effect": "Hard ceiling on the capability tier."
    },
    {
      "name": "paused",
      "type": "boolean",
      "default": false,
      "effect": "Universal pause prop. Forces the content visible and still. Where the browser supports CSS scroll-driven animation the reveal is driven by the scroll position and this prop has no effect."
    },
    {
      "name": "nonce",
      "type": "string",
      "default": null,
      "effect": "Optional CSP nonce forwarded to the internal scoped <style> element (one is rendered per instance)."
    }
  ],
  "agent": {
    "install": "npx shadcn@latest add @frictionborn/scroll-reveal",
    "usage": "import { ScrollReveal } from \"@/components/ui/scroll-reveal\";\n\nexport default function CardGrid() {\n  return (\n    <ScrollReveal animation=\"fade-up\" distance={24}>\n      <div className=\"rounded-lg border p-6\">\n        <h3>Feature Title</h3>\n        <p>Feature description.</p>\n      </div>\n    </ScrollReveal>\n  );\n}",
    "mistakes": [
      "Do not use ScrollReveal on above-the-fold hero elements; hero text should be visible immediately for LCP.",
      "Do not nest ScrollReveal components inside each other; keep entrance containers flat.",
      "The reveal only runs when <html> has data-motion=\"ok\" (MotionReadyScript in Next, initMotionReady() in Vite); without it the content is static.",
      "Other props (id, data-*, aria-*, handlers) are spread on the root element."
    ],
    "verify": [
      "Verify content is visible in server HTML without JavaScript execution.",
      "Verify tabbing into hidden cards forces them visible immediately via focus guard.",
      "Verify reduced motion renders final visible content with zero animation delays."
    ]
  },
  "license": {
    "code": "MIT",
    "derivedFrom": [],
    "notices": [],
    "assets": []
  }
}
