{
  "schemaVersion": "0.1",
  "item": {
    "name": "particle-field",
    "version": "0.1.0",
    "summary": "background: WebGL2 vertex-shader particle drift with pointer repel (webgl2, client-only, reduced motion -> poster, mobile -> tier 2 / tier 1 poster)",
    "slot": "background",
    "kind": "webgl"
  },
  "intent": {
    "useWhen": [
      "Hero sections requiring discrete starry or kinetic depth points",
      "Telemetry or scientific landing pages needing particle drift and fine pointer interaction",
      "Surfaces seeking subtle stellar motion with constant GPU cost"
    ],
    "avoidWhen": [
      "Dense text sections where text contrast over the particles has not been verified",
      "Pages already running a continuous full-screen shader",
      "Low-power mobile devices where the static dot pattern is preferred"
    ],
    "alternatives": [
      {
        "name": "noise-field",
        "when": "When continuous organic liquid waves are preferred over discrete points"
      },
      {
        "name": "mesh-gradient",
        "when": "When soft blurred color transitions are preferred"
      }
    ]
  },
  "runtime": {
    "serverOutput": "poster",
    "clientOnly": true,
    "lazyLoaded": "in-view",
    "requires": {
      "react": ">=19",
      "frameworks": [
        "next-app-router",
        "vite-react"
      ],
      "tailwind": "none"
    }
  },
  "dependencies": {
    "npm": [],
    "registry": []
  },
  "behavior": {
    "loop": "while-visible",
    "webglContexts": 1,
    "tiers": {
      "0": "CSS dot-pattern poster only, no WebGL (server render, prefers-reduced-motion, Save-Data, no WebGL2, or frame-guard downgrade)",
      "1": "CSS dot-pattern poster only (coarse pointer with low-end hints: deviceMemory <= 2 or <= 4 cores)",
      "2": "WebGL2 at DPR <= 1.5 with 35% of `count` particles (coarse pointer without low-end hints, or fine pointer with low-end hints or viewport < 480px)",
      "3": "WebGL2 at DPR <= 2.0 with `count` particles, up to 4,000 (fine pointer with hover, no low-end hints)"
    },
    "reducedMotion": {
      "mode": "static",
      "description": "Renders the static CSS dot-pattern poster with no WebGL context and no animation frames. Under prefers-reduced-motion the runtime tier is 0, so WebGL does not start."
    },
    "input": {
      "pointer": "Pointer repulsion within a 140px radius, only when interactive is true and the device reports pointer: fine (window pointermove listener, mouse and pen only)",
      "touch": "No pointer listeners are attached when the device does not report pointer: fine. Coarse pointers with low-end hints get the tier 1 poster; other coarse-pointer devices run the drift at tier 2.",
      "keyboard": "None; the component has no interactive elements. Poster, scrim and canvas layers are aria-hidden; children keep their own semantics."
    }
  },
  "a11y": {
    "role": "decorative",
    "hiddenFromAT": true,
    "textStaysInDom": true,
    "pauseControl": "via-runtime",
    "wcag": [
      "2.2.2",
      "2.3.1"
    ],
    "notes": "The poster, scrim and canvas layers are aria-hidden; the root element and children are not. Particle twinkle runs at about 0.3 Hz (sin(phase + time * 1.8) in the vertex shader), well below 3 flashes per second. There is no built-in pause button: pause with the paused prop or the runtime pauseAll()/resumeAll(). The optional scrim lowers background luminance but contrast is not computed; verify text contrast for your colours."
  },
  "composition": {
    "maxPerPage": 1,
    "singleton": false,
    "conflictsWith": [
      "noise-field",
      "mesh-gradient"
    ],
    "pairsWith": [
      "text-reveal",
      "magnetic-button",
      "scroll-reveal"
    ]
  },
  "props": [
    {
      "name": "color",
      "type": "string",
      "default": "var(--primary, CanvasText)",
      "effect": "Particle CSS colour, resolved from CSS variables or theme tokens and also used for the dot-pattern poster."
    },
    {
      "name": "speed",
      "type": "number",
      "default": 1,
      "effect": "Kinematic drift rate multiplier."
    },
    {
      "name": "count",
      "type": "number",
      "default": 2000,
      "effect": "Target particle count on Tier 3 (clamped to 4,000). Tier 2 renders 35% of it."
    },
    {
      "name": "interactive",
      "type": "boolean",
      "default": true,
      "effect": "Enables pointer repulsion; only active when the device reports pointer: fine."
    },
    {
      "name": "scrim",
      "type": "boolean",
      "default": false,
      "effect": "Renders a vertical gradient of the host --background token (40% to 75% opacity) over the canvas to lower background luminance behind children. Does not guarantee text contrast; verify for your colours."
    },
    {
      "name": "paused",
      "type": "boolean",
      "default": false,
      "effect": "Freezes this instance's particle loop. The global pauseAll() also stops it."
    },
    {
      "name": "maxTier",
      "type": "number",
      "default": 3,
      "effect": "Upper bound on the capability tier (0 to 3); the tier is the minimum of this and the runtime tier."
    },
    {
      "name": "reducedMotion",
      "type": "boolean",
      "default": null,
      "effect": "Optional. No default (follows prefers-reduced-motion). true forces the static poster. false only skips the prop-level check: under prefers-reduced-motion the runtime tier is still 0, so WebGL still does not start. Leave unset."
    },
    {
      "name": "className",
      "type": "string",
      "default": "",
      "effect": "Extra classes on the root div (the built-in class fb-particle-field is kept)."
    },
    {
      "name": "style",
      "type": "React.CSSProperties",
      "default": null,
      "effect": "Optional. No default. Inline styles on the root div, merged after the built-in layout and background (consumer wins)."
    },
    {
      "name": "ref",
      "type": "React.Ref<HTMLDivElement>",
      "default": null,
      "effect": "Receives the root <div> that holds the poster and the canvas."
    },
    {
      "name": "children",
      "type": "React.ReactNode",
      "default": null,
      "effect": "Optional. No default. Content layered above the poster, canvas and scrim."
    }
  ],
  "agent": {
    "install": "npx shadcn@4.21.1 add @frictionborn/particle-field",
    "usage": "import { ParticleField } from \"@/components/ui/particle-field\";\n\nexport default function Hero() {\n  return (\n    <ParticleField count={2000} className=\"min-h-[600px] flex items-center justify-center\">\n      <h1 className=\"text-5xl font-bold tracking-tight text-foreground\">Sub-Angstrom Kinematics</h1>\n    </ParticleField>\n  );\n}",
    "mistakes": [
      "Do not attach your own window mouse listeners for repulsion; ParticleField already adds one window pointermove listener, only on devices that report pointer: fine.",
      "Do not combine multiple ParticleField instances in the same viewport.",
      "scrim defaults to false. It only lowers background luminance and does not guarantee 4.5:1 contrast: verify contrast for your colours and use host foreground tokens for text.",
      "Do not set reducedMotion={false} to try to force WebGL; it does not override the user's preference (the runtime tier stays 0 under prefers-reduced-motion).",
      "Never call requestAnimationFrame directly to animate particles."
    ],
    "verify": [
      "Confirm the static CSS dot-pattern poster renders in server HTML (CLS <= 0.01).",
      "Confirm that when prefers-reduced-motion is active, the static poster renders with zero WebGL contexts allocated and zero rAF cycles.",
      "Confirm context lease is released when scrolled out of view."
    ]
  },
  "license": {
    "code": "MIT",
    "derivedFrom": [],
    "notices": [],
    "assets": []
  },
  "measured": {
    "commit": "53fd14c",
    "date": "2026-10-05",
    "sizeKB": {
      "initial": 2.34,
      "deferred": 3.5,
      "method": "gzip-9"
    },
    "cls": 0.0003,
    "framesWhenIdle": {
      "offscreen": 0,
      "hiddenTab": 0,
      "reducedMotion": 0
    },
    "axe": {
      "serious": 0,
      "critical": 0
    },
    "devices": [
      {
        "env": "Chromium Desktop (SwiftShader)",
        "via": "playwright",
        "tier": 3,
        "result": "pass",
        "date": "2026-10-05",
        "notes": "17 passed, 0 failed"
      },
      {
        "env": "Chromium Mobile (Pixel 7 emulation)",
        "via": "playwright",
        "tier": 2,
        "result": "pass",
        "date": "2026-10-05",
        "notes": "17 passed, 0 failed"
      },
      {
        "env": "Firefox Desktop",
        "via": "playwright",
        "tier": 3,
        "result": "pass",
        "date": "2026-10-05",
        "notes": "15 passed, 0 failed"
      },
      {
        "env": "WebKit Desktop",
        "via": "playwright",
        "tier": 3,
        "result": "pass",
        "date": "2026-10-05",
        "notes": "15 passed, 0 failed"
      },
      {
        "env": "WebKit Mobile (iPhone 14 emulation)",
        "via": "playwright",
        "tier": 2,
        "result": "pass",
        "date": "2026-10-05",
        "notes": "15 passed, 0 failed"
      }
    ]
  }
}
