{
  "schemaVersion": "0.1",
  "item": {
    "name": "magnetic-button",
    "version": "0.1.0",
    "summary": "cta: Magnetic spring wrapper for buttons and links with fine-pointer gating (dom, server-safe, reduced motion -> static, mobile -> 0 listeners)",
    "slot": "cta",
    "kind": "dom"
  },
  "intent": {
    "useWhen": [
      "High-priority call-to-action buttons in hero and conversion sections",
      "Interactive icon triggers and primary action links",
      "Header navigation actions seeking tactile physical response"
    ],
    "avoidWhen": [
      "Dense lists of repeating table buttons or compact toolbar grids",
      "Touch-first mobile interfaces with coarse pointer navigation",
      "Disabled or read-only interactive elements"
    ],
    "alternatives": [
      {
        "name": "text-reveal",
        "when": "When animating entrance typography rather than interactive hover responses"
      }
    ]
  },
  "runtime": {
    "serverOutput": "final-state",
    "clientOnly": false,
    "lazyLoaded": "no",
    "requires": {
      "react": ">=19",
      "frameworks": [
        "next-app-router",
        "vite-react"
      ],
      "tailwind": "none"
    }
  },
  "dependencies": {
    "npm": [],
    "registry": []
  },
  "behavior": {
    "loop": "on-interaction",
    "webglContexts": 0,
    "tiers": {
      "0": "Static wrapper without pointer handlers or translation (server render, prefers-reduced-motion, Save-Data, or no WebGL2)",
      "1": "Static wrapper without pointer handlers (coarse pointer with low-end hints)",
      "2": "Magnetic pull with the configured strength, only when the device reports (hover: hover) and (pointer: fine)",
      "3": "Same behaviour as tier 2: spring physics on the shared frame loop while the pointer is over the wrapper, settling to zero frames"
    },
    "reducedMotion": {
      "mode": "static",
      "description": "Button retains static position without magnetic cursor tracking."
    },
    "input": {
      "pointer": "Cursor attraction with physical spring settling within 0.01px tolerance",
      "touch": "Zero pointer handlers attached on coarse/touch screens",
      "keyboard": "Focus snaps the wrapper to its origin immediately and the child's own onFocus still runs; the wrapper uses overflow: visible"
    }
  },
  "a11y": {
    "role": "interactive",
    "hiddenFromAT": false,
    "textStaysInDom": true,
    "pauseControl": "not-needed",
    "wcag": [
      "2.1.1",
      "2.4.7",
      "2.5.3"
    ],
    "notes": "The wrapped button or link keeps its native semantics. The wrapper div uses overflow: visible so it does not clip focus rings, and keyboard focus immediately resets translation to origin."
  },
  "composition": {
    "maxPerPage": 10,
    "singleton": false,
    "conflictsWith": [],
    "pairsWith": [
      "noise-field",
      "text-reveal",
      "ambient-hero"
    ]
  },
  "props": [
    {
      "name": "children",
      "type": "React.ReactElement",
      "default": null,
      "effect": "Required. A single interactive element (button or link) wrapped by the magnetic controller."
    },
    {
      "name": "pullDistance",
      "type": "number",
      "default": 16,
      "effect": "Maximum pull translation in pixels (replaces deprecated strength)."
    },
    {
      "name": "paused",
      "type": "boolean",
      "default": false,
      "effect": "Universal pause prop. Freezes magnetic displacement calculation."
    },
    {
      "name": "tension",
      "type": "number",
      "default": 180,
      "effect": "Spring stiffness coefficient."
    },
    {
      "name": "damping",
      "type": "number",
      "default": 16,
      "effect": "Spring velocity damping coefficient."
    },
    {
      "name": "className",
      "type": "string",
      "default": "",
      "effect": "Additional CSS classes applied to the outer wrapper div (the built-in class fb-magnetic-button is kept)."
    },
    {
      "name": "style",
      "type": "React.CSSProperties",
      "default": null,
      "effect": "Optional. No default. Inline styles on the wrapper div, merged after display: inline-block and position: relative (consumer wins)."
    },
    {
      "name": "maxTier",
      "type": "number",
      "default": 3,
      "effect": "Hard ceiling on the capability tier."
    }
  ],
  "agent": {
    "install": "npx shadcn@latest add @frictionborn/magnetic-button",
    "usage": "import { MagneticButton } from \"@/components/ui/magnetic-button\";\n\nexport default function HeroCta() {\n  return (\n    <MagneticButton strength={16}>\n      <button type=\"button\" className=\"rounded-full bg-primary px-6 py-3 text-primary-foreground font-medium\">\n        Get Started\n      </button>\n    </MagneticButton>\n  );\n}",
    "mistakes": [
      "Do not set overflow: hidden on MagneticButton or parent containers, or focus rings will be clipped.",
      "Do not wrap non-interactive static text in MagneticButton; reserve for buttons and action links.",
      "MagneticButton renders a wrapper div (display: inline-block) around the child, so do not place it inside a <p> or another <button>.",
      "It accepts only the listed props; data-* and aria-* attributes are not forwarded to the wrapper (put them on the child)."
    ],
    "verify": [
      "Verify button is immediately clickable and focusable in server HTML.",
      "Verify keyboard tabbing triggers focus ring cleanly without clipped edges.",
      "Verify that on touch screens, zero pointer handlers are registered."
    ]
  },
  "license": {
    "code": "MIT",
    "derivedFrom": [],
    "notices": [],
    "assets": []
  }
}
